commit	stage	primary_metric	status	description
working	candidate	0.845839	discard	candidate checkpoint benchmark selected distilbert-incumbent with final min recall 0.8458 [20260318_141016_candidate-checkpoint-benchmark-ground-truth]
working	candidate	0.845839	discard	candidate model selection kept incumbent-distilbert-rebuilt with final min recall 0.8458 and promotion delta 0.0000 [20260318_144131_candidate-model-selection-ground-truth-full]
working	candidate	0.792633	discard	candidate input branch suite winner distilbert-from-incumbent-marked_window_v1-seed-42 reached final min recall 0.7926 with promotion delta -0.0532 [20260319_235637_candidate-input-branch-suite]
working	candidate	0.846995	discard	candidate checkpoint benchmark selected distilbert-incumbent with final min recall 0.8470 [20260321_224321_candidate-checkpoint-benchmark-ground-truth-20260321]
